[
 {
  "source_id": "MS002-SRC-C",
  "slice_id": "SL-C-01",
  "raw_claims": [
   {
    "temporary_claim_id": "TC-001",
    "text": "O primeiro passo é instalar o Redis na sua VPS.",
    "source_language": "pt",
    "evidence_refs": [
     "EV-0004"
    ],
    "qualifiers": {
     "scope": "montagem do chatbot de WhatsApp com n8n",
     "condition": null,
     "platform": "VPS",
     "stage": "primeiro passo",
     "audience": null
    },
    "status": "SOURCE_EXPLICIT"
   },
   {
    "temporary_claim_id": "TC-002",
    "text": "O Redis é um banco de dados não relacional que utiliza chaves e valores para guardar os dados, e nele é possível configurar dados com tempo de vida, o que o torna ideal para essas operações.",
    "source_language": "pt",
    "evidence_refs": [
     "EV-0004",
     "EV-0005"
    ],
    "qualifiers": {
     "scope": "operações do chatbot descrito",
     "condition": null,
     "platform": "Redis",
     "stage": null,
     "audience": null
    },
    "status": "SOURCE_EXPLICIT"
   },
   {
    "temporary_claim_id": "TC-003",
    "text": "Para instalar o Redis, vá no EasyPanel, clique no mais para adicionar um novo serviço no projeto, escolha a opção redis, coloque um nome pro serviço, deixe a senha em branco para gerar uma aleatória, não mexa na versão e clique em criar.",
    "source_language": "pt",
    "evidence_refs": [
     "EV-0006",
     "EV-0007",
     "EV-0008"
    ],
    "qualifiers": {
     "scope": null,
     "condition": null,
     "platform": "EasyPanel",
     "stage": "instalação do Redis",
     "audience": null
    },
    "status": "SOURCE_EXPLICIT"
   },
   {
    "temporary_claim_id": "TC-004",
    "text": "Ative a opção do Redis Commander porque ele é muito útil para o desenvolvimento: é um painel de gerenciamento do Redis onde você pode visualizar, editar ou apagar os dados pelo navegador.",
    "source_language": "pt",
    "evidence_refs": [
     "EV-0008",
     "EV-0009",
     "EV-0010"
    ],
    "qualifiers": {
     "scope": "desenvolvimento",
     "condition": null,
     "platform": "EasyPanel / Redis Commander",
     "stage": "após instalar o Redis",
     "audience": null
    },
    "status": "SOURCE_EXPLICIT"
   },
   {
    "temporary_claim_id": "TC-005",
    "text": "O próximo passo é pegar uma chave de API do Groq, da OpenAI ou de qualquer outro provedor que você tiver.",
    "source_language": "pt",
    "evidence_refs": [
     "EV-0010"
    ],
    "qualifiers": {
     "scope": null,
     "condition": null,
     "platform": null,
     "stage": "após instalar o Redis",
     "audience": null
    },
    "status": "SOURCE_EXPLICIT"
   },
   {
    "temporary_claim_id": "TC-006",
    "text": "O Groq é apresentado como uma opção porque é gratuito.",
    "source_language": "pt",
    "evidence_refs": [
     "EV-0011",
     "EV-0012"
    ],
    "qualifiers": {
     "scope": null,
     "condition": null,
     "platform": "Groq",
     "stage": null,
     "audience": null
    },
    "status": "SOURCE_EXPLICIT"
   },
   {
    "temporary_claim_id": "TC-007",
    "text": "No site do Groq, vá em Dev Console, faça login com o Google, do lado esquerdo vá em API Keys, clique para criar uma nova, dê um nome, marque a caixinha e clique em submit.",
    "source_language": "pt",
    "evidence_refs": [
     "EV-0012",
     "EV-0013"
    ],
    "qualifiers": {
     "scope": null,
     "condition": null,
     "platform": "Groq",
     "stage": "obtenção da chave de API",
     "audience": null
    },
    "status": "SOURCE_EXPLICIT"
   },
   {
    "temporary_claim_id": "TC-008",
    "text": "Você precisa copiar a chave assim que ela é exibida e colar num bloco de notas, porque depois que sair dessa tela não tem mais como ver.",
    "source_language": "pt",
    "evidence_refs": [
     "EV-0013",
     "EV-0014"
    ],
    "qualifiers": {
     "scope": "chaves de API do Groq e da OpenAI",
     "condition": "ao gerar a chave",
     "platform": null,
     "stage": null,
     "audience": null
    },
    "status": "SOURCE_EXPLICIT"
   },
   {
    "temporary_claim_id": "TC-009",
    "text": "Na OpenAI precisa colocar 5 (dólares) para poder gerar uma chave.",
    "source_language": "pt",
    "evidence_refs": [
     "EV-0014",
     "EV-0015"
    ],
    "qualifiers": {
     "scope": null,
     "condition": "para gerar uma chave na OpenAI",
     "platform": "OpenAI",
     "stage": null,
     "audience": null
    },
    "status": "SOURCE_EXPLICIT"
   },
   {
    "temporary_claim_id": "TC-010",
    "text": "Na OpenAI, vá nas configurações em API Keys, clique para criar uma nova, dê um nome, selecione de qual projeto ela faz parte e clique em criar; depois copie e salve a chave num bloco de notas.",
    "source_language": "pt",
    "evidence_refs": [
     "EV-0015",
     "EV-0016"
    ],
    "qualifiers": {
     "scope": null,
     "condition": null,
     "platform": "OpenAI",
     "stage": "obtenção da chave de API",
     "audience": null
    },
    "status": "SOURCE_EXPLICIT"
   },
   {
    "temporary_claim_id": "TC-011",
    "text": "Antes de criar o workflow no n8n, vá em settings > community nodes e veja se você tem os nodes da Evolution API instalados; se não tiver, clique em Install, digite n8n nodes Evolution api e clique em instalar.",
    "source_language": "pt",
    "evidence_refs": [
     "EV-0017",
     "EV-0018"
    ],
    "qualifiers": {
     "scope": null,
     "condition": "se os nodes não estiverem instalados",
     "platform": "n8n",
     "stage": "antes de criar o workflow",
     "audience": null
    },
    "status": "SOURCE_EXPLICIT"
   },
   {
    "temporary_claim_id": "TC-012",
    "text": "Para começar o workflow, adicione um node de Webhook, configure o método dele como POST e copie a URL de teste.",
    "source_language": "pt",
    "evidence_refs": [
     "EV-0020"
    ],
    "qualifiers": {
     "scope": null,
     "condition": null,
     "platform": "n8n",
     "stage": "início do workflow",
     "audience": null
    },
    "status": "SOURCE_EXPLICIT"
   },
   {
    "temporary_claim_id": "TC-013",
    "text": "Na Evolution, clique na sua sessão, vá em events webhook, cole a URL, e as três opções enabled, base 64 e o evento messages upsert têm que estar ativas; depois clique em salvar.",
    "source_language": "pt",
    "evidence_refs": [
     "EV-0021",
     "EV-0022"
    ],
    "qualifiers": {
     "scope": null,
     "condition": null,
     "platform": "Evolution API",
     "stage": "configuração do webhook",
     "audience": null
    },
    "status": "SOURCE_EXPLICIT"
   },
   {
    "temporary_claim_id": "TC-014",
    "text": "De volta ao n8n, clique para ouvir um evento de teste e mande uma mensagem para você mesmo no seu WhatsApp para receber os dados.",
    "source_language": "pt",
    "evidence_refs": [
     "EV-0022",
     "EV-0023"
    ],
    "qualifiers": {
     "scope": null,
     "condition": null,
     "platform": "n8n / WhatsApp",
     "stage": "teste do webhook",
     "audience": null
    },
    "status": "SOURCE_EXPLICIT"
   },
   {
    "temporary_claim_id": "TC-015",
    "text": "Nunca se usa diretamente os dados que vêm no webhook; sempre se adiciona um node Set depois do Webhook para organizá-los de uma forma melhor.",
    "source_language": "pt",
    "evidence_refs": [
     "EV-0023",
     "EV-0024"
    ],
    "qualifiers": {
     "scope": "dados vindos do webhook",
     "condition": null,
     "platform": "n8n",
     "stage": "após o webhook",
     "audience": null
    },
    "status": "SOURCE_EXPLICIT"
   },
   {
    "temporary_claim_id": "TC-016",
    "text": "De todos os dados do webhook são usados apenas cinco campos: quem mandou (número da pessoa), a instância que recebeu a mensagem, a mensagem, o ID da mensagem e o nome da pessoa.",
    "source_language": "pt",
    "evidence_refs": [
     "EV-0025",
     "EV-0026"
    ],
    "qualifiers": {
     "scope": "este workflow",
     "condition": null,
     "platform": "n8n",
     "stage": "node Set",
     "audience": null
    },
    "status": "SOURCE_EXPLICIT"
   },
   {
    "temporary_claim_id": "TC-017",
    "text": "Os campos ficam em: quem mandou em body data key remoteJid, a instância em body instance, a mensagem em body data message conversation, o ID da mensagem em body data key id e o nome da pessoa em body data pushName.",
    "source_language": "pt",
    "evidence_refs": [
     "EV-0027",
     "EV-0028"
    ],
    "qualifiers": {
     "scope": null,
     "condition": null,
     "platform": "Evolution API webhook payload",
     "stage": "node Set",
     "audience": null
    },
    "status": "SOURCE_EXPLICIT"
   },
   {
    "temporary_claim_id": "TC-018",
    "text": "Clique em teste e renomeie esse node para 'dados'.",
    "source_language": "pt",
    "evidence_refs": [
     "EV-0028",
     "EV-0029"
    ],
    "qualifiers": {
     "scope": null,
     "condition": null,
     "platform": "n8n",
     "stage": "node Set",
     "audience": null
    },
    "status": "SOURCE_EXPLICIT"
   },
   {
    "temporary_claim_id": "TC-019",
    "text": "Antes de criar o agente de IA, coloque um Set vazio, porque isso vai ser melhor no futuro; depois desse Set vazio coloque o AI Agent.",
    "source_language": "pt",
    "evidence_refs": [
     "EV-0030"
    ],
    "qualifiers": {
     "scope": null,
     "condition": null,
     "platform": "n8n",
     "stage": "antes do AI Agent",
     "audience": null
    },
    "status": "SOURCE_EXPLICIT"
   },
   {
    "temporary_claim_id": "TC-020",
    "text": "O agente de IA é composto por quatro peças: o modelo de Inteligência Artificial (o cérebro), a memória de chat (onde guarda o histórico de mensagens com a pessoa), as ferramentas que o agente pode utilizar (por exemplo pesquisar na internet, alterar planilhas, buscar em banco de dados) e o agente em si (onde se colocam as instruções).",
    "source_language": "pt",
    "evidence_refs": [
     "EV-0031",
     "EV-0032",
     "EV-0033",
     "EV-0034"
    ],
    "qualifiers": {
     "scope": null,
     "condition": null,